{
  "$schema": "Inu.ComponentDefinition.schema.json",
  "schemaVersion": 1,
  "id": "Kernel.Session.TextConsole",
  "displayName": "Text console session",
  "area": "Userland",
  "selection": {
    "status": "selectable",
    "reason": "Kernel startup policy is OS-owned. Kath can include, omit, replace or reorder this startup source component."
  },
  "lifecycle": {
    "ownership": "os",
    "startup": "boot"
  },
  "contracts": {
    "provides": [
      "kernel.session.text-console"
    ],
    "requires": []
  },
  "dependencies": [],
  "implementations": {
    "CSharp": {
      "status": "available",
      "project": null,
      "sources": [
        "src/Inu.Kernel.Bootstrap/SourceComponents/Startup/TextConsoleSessionStartup.cs"
      ]
    }
  }
}
