{
  "$schema": "Inu.ComponentDefinition.schema.json",
  "schemaVersion": 1,
  "id": "Kernel.Startup.PlatformTables",
  "displayName": "Platform tables startup",
  "area": "Kernel",
  "selection": {
    "status": "selectable",
    "reason": "Kernel startup policy is OS-owned. Kath can include, omit, replace or reorder this startup source component."
  },
  "lifecycle": {
    "ownership": "os",
    "startup": "boot"
  },
  "contracts": {
    "provides": [
      "kernel.startup.platform-tables"
    ],
    "requires": []
  },
  "dependencies": [],
  "implementations": {
    "CSharp": {
      "status": "available",
      "project": null,
      "sources": [
        "src/Inu.Kernel.Bootstrap/SourceComponents/Boot/PlatformTablesStartup.cs"
      ]
    }
  }
}
