{
  "$schema": "Inu.ComponentDefinition.schema.json",
  "schemaVersion": 1,
  "id": "Kernel.Processes.ForegroundControl",
  "displayName": "Foreground process ownership",
  "area": "Kernel",
  "selection": {
    "status": "selectable",
    "reason": "0.2.30: this responsibility is registered through a neutral process-service contract; the KernelProcesses facade and record store no longer name the concrete provider, so Kath may include, omit, or substitute it independently subject to declared dependencies."
  },
  "lifecycle": {
    "ownership": "kernel",
    "startup": "parent-controlled"
  },
  "contracts": {
    "provides": [
      "process.foreground-ownership",
      "process.foreground-cancellation"
    ],
    "requires": [
      "process.records",
      "process.signalling"
    ]
  },
  "dependencies": [
    "Kernel.Processes.ServiceRegistry",
    "Kernel.Processes.RecordStore",
    "Kernel.Processes.Signals"
  ],
  "implementations": {
    "CSharp": {
      "status": "available",
      "project": "src/Inu.Kernel.Processes/Inu.Kernel.Processes.csproj",
      "sources": [
        "src/Inu.Kernel.Processes/KernelProcesses.Foreground.cs",
        "src/Inu.Kernel.Processes/KernelProcessForegroundProvider.cs"
      ]
    }
  }
}
