{
  "$schema": "Inu.ComponentDefinition.schema.json",
  "schemaVersion": 1,
  "id": "Kernel.Hardware.Graphics",
  "displayName": "Graphics hardware startup",
  "area": "Kernel",
  "selection": {
    "status": "selectable",
    "reason": "Hardware policy is OS-owned. Kath can include, omit, replace or reorder this source component."
  },
  "lifecycle": {
    "ownership": "os",
    "startup": "boot"
  },
  "contracts": {
    "provides": [
      "kernel.hardware.graphics"
    ],
    "requires": [
      "kernel.hardware.driver-infrastructure",
      "kernel.graphics.display-registry"
    ]
  },
  "dependencies": [
    "Kernel.Hardware.DriverInfrastructure",
    "Kernel.Graphics.DisplayRegistry"
  ],
  "implementations": {
    "CSharp": {
      "status": "available",
      "project": null,
      "sources": [
        "src/Inu.Kernel.Bootstrap/SourceComponents/HAL/GraphicsHardwareStartup.cs"
      ]
    }
  }
}
