{
  "$schema": "Inu.ComponentDefinition.schema.json",
  "schemaVersion": 1,
  "id": "Kernel.Startup.Smp",
  "displayName": "SMP startup",
  "area": "Kernel",
  "selection": {
    "status": "selectable",
    "reason": "Kernel startup policy is OS-owned. Kath can include, omit, replace or reorder this startup source component."
  },
  "lifecycle": {
    "ownership": "os",
    "startup": "boot"
  },
  "contracts": {
    "provides": [
      "kernel.startup.smp"
    ],
    "requires": [
      "boot.ap-trampoline"
    ]
  },
  "dependencies": [
    "Boot.ApplicationProcessorTrampoline"
  ],
  "implementations": {
    "CSharp": {
      "status": "available",
      "project": null,
      "sources": [
        "src/Inu.Kernel.Bootstrap/SourceComponents/Boot/SmpStartup.cs"
      ]
    }
  }
}
