{
  "$schema": "Inu.ComponentDefinition.schema.json",
  "schemaVersion": 1,
  "id": "Kernel.Hardware.Usb",
  "displayName": "USB hardware startup",
  "area": "Kernel",
  "selection": {
    "status": "selectable",
    "reason": "Hardware policy is OS-owned. Kath can include, omit, replace or reorder this source component."
  },
  "lifecycle": {
    "ownership": "os",
    "startup": "boot"
  },
  "contracts": {
    "provides": [
      "kernel.hardware.usb"
    ],
    "requires": [
      "kernel.hardware.driver-infrastructure"
    ]
  },
  "dependencies": [
    "Kernel.Hardware.DriverInfrastructure",
    "Kernel.Usb.BusContract",
    "Kernel.Usb.Enumeration"
  ],
  "implementations": {
    "CSharp": {
      "status": "available",
      "project": null,
      "sources": [
        "src/Inu.Kernel.Bootstrap/SourceComponents/HAL/UsbHardwareStartup.cs"
      ]
    }
  }
}
